{
  "$schema": "https://json-schema.org/draft/2020-12/schema",
  "$id": "https://ragpp.local/schemas/raw-articles.schema.json",
  "title": "Shanghanlun raw articles",
  "type": "array",
  "items": {
    "type": "object",
    "additionalProperties": false,
    "required": ["id", "chapter", "section", "category", "text"],
    "properties": {
      "id": {"type": "integer", "minimum": 1},
      "chapter": {"type": "string", "minLength": 1},
      "section": {"type": "string", "minLength": 1},
      "category": {"type": "string", "minLength": 1},
      "text": {"type": "string", "minLength": 1}
    }
  }
}
