[
  {
    "id": 1,
    "chapter": "辨太阳病脉证并治上",
    "section": "太阳病篇",
    "category": "太阳病",
    "text": "太阳之为病，脉浮，头项强痛而恶寒。"
  },
  {
    "id": 2,
    "chapter": "辨太阳病脉证并治上",
    "section": "太阳病篇",
    "category": "太阳病",
    "text": "太阳病，发热，汗出，恶风，脉缓者，名为中风。"
  },
  {
    "id": 3,
    "chapter": "辨太阳病脉证并治上",
    "section": "太阳病篇",
    "category": "太阳病",
    "text": "太阳病，或已发热，或未发热，必恶寒，体痛，呕逆，脉阴阳俱紧者，名为伤寒。"
  },
  {
    "id": 4,
    "chapter": "辨太阳病脉证并治上",
    "section": "太阳病篇",
    "category": "太阳病",
    "text": "伤寒一日，太阳受之，脉若静者，为不传；颇欲吐，若躁烦，脉数急者，为传也。"
  },
  {
    "id": 5,
    "chapter": "辨太阳病脉证并治上",
    "section": "太阳病篇",
    "category": "太阳病",
    "text": "伤寒二三日，阳明、少阳证不见者，为不传也。"
  },
  {
    "id": 6,
    "chapter": "辨太阳病脉证并治上",
    "section": "太阳病篇",
    "category": "太阳病",
    "text": "太阳病，发热而渴，不恶寒者，为温病。若发汗已，身灼热者，名风温。风温为病，脉阴阳俱浮，自汗出，身重，多眠睡，鼻息必鼾，语言难出。若被下者，小便不利，直视失溲；若被火者，微发黄色，剧则如惊痫，时瘛疭；若火熏之，一逆尚引日，再逆促命期。"
  },
  {
    "id": 7,
    "chapter": "辨太阳病脉证并治上",
    "section": "太阳病篇",
    "category": "太阳病",
    "text": "病有发热恶寒者，发于阳也；无热恶寒者，发于阴也。发于阳者，七日愈；发于阴者，六日愈。以阳数七，阴数六故也。"
  },
  {
    "id": 8,
    "chapter": "辨太阳病脉证并治上",
    "section": "太阳病篇",
    "category": "太阳病",
    "text": "太阳病，头痛至七日以上自愈者，以行其经尽故也。若欲作再经者，针足阳明，使经不传则愈。"
  },
  {
    "id": 9,
    "chapter": "辨太阳病脉证并治上",
    "section": "太阳病篇",
    "category": "太阳病",
    "text": "太阳病，欲解时，从巳至未上。"
  },
  {
    "id": 10,
    "chapter": "辨太阳病脉证并治上",
    "section": "太阳病篇",
    "category": "太阳病",
    "text": "观今之医，不念思求经旨，以演其所知，各承家技，始终顺旧。省疾问病，务在口给，相对斯须，便处汤药，按寸不及尺，握手不及足，人迎趺阳，三部不参，动数发息，不满五十，短期未知决诊，九候曾无仿佛，明堂阙庭，尽不见察，所谓窥管而已。夫欲视死别生，实为难矣！"
  },
  {
    "id": 11,
    "chapter": "辨太阳病脉证并治上",
    "section": "太阳病篇",
    "category": "太阳病",
    "text": "病在阳，应以汗解之，反以冷水噀之，若灌之，其热被劫不得去，弥更益烦，肉上粟起，意欲饮水，反不渴，服文蛤散；若不瘥者，与五苓散。寒实结胸，无热证者，与三物小陷胸汤，白散亦可服。"
  },
  {
    "id": 12,
    "chapter": "辨太阳病脉证并治上",
    "section": "太阳病篇",
    "category": "太阳病",
    "text": "太阳中风，阳浮而阴弱，阳浮者热自发，阴弱者汗自出，啬啬恶寒，淅淅恶风，翕翕发热，鼻鸣干呕者，桂枝汤主之。桂枝汤方：桂枝三两去皮，芍药三两，甘草二两炙，生姜三两切，大枣十二枚擘。右五味，㕮咀三味，以水七升，微火煮取三升，去滓，适寒温，服一升。服已须臾，啜热稀粥一升余，以助药力。温覆令一时许，遍身漐漐微似有汗者益佳，不可令如水流漓，病必不除。若一服汗出病瘥，停后服，不必尽剂；若不汗，更服依前法；又不汗，后服小促其间，半日许令三服尽。若病重者，一日一夜服，周时观之。服一剂尽，病证犹在者，更作服；若汗不出，乃服至二、三剂。禁生冷、黏滑、肉面、五辛、酒酪、臭恶等物。"
  },
  {
    "id": 13,
    "chapter": "辨太阳病脉证并治上",
    "section": "太阳病篇",
    "category": "太阳病",
    "text": "太阳病，头痛发热，汗出恶风，桂枝汤主之。"
  },
  {
    "id": 14,
    "chapter": "辨太阳病脉证并治上",
    "section": "太阳病篇",
    "category": "太阳病",
    "text": "太阳病，项背强几几，反汗出恶风者，桂枝加葛根汤主之。桂枝加葛根汤方：葛根四两，麻黄三两去节，芍药三两，生姜三两切，大枣十二枚擘，桂枝三两去皮，甘草二两炙。右七味，以水一斗，先煮麻黄、葛根，减二升，去上沫，内诸药，煮取三升，去滓，温服一升。覆取微似汗，不须啜粥，余如桂枝法将息及禁忌。"
  },
  {
    "id": 15,
    "chapter": "辨太阳病脉证并治上",
    "section": "太阳病篇",
    "category": "太阳病",
    "text": "太阳病，下之后，其气上冲者，可与桂枝汤，方用前法；若不上冲者，不得与之。"
  },
  {
    "id": 16,
    "chapter": "辨太阳病脉证并治上",
    "section": "太阳病篇",
    "category": "太阳病",
    "text": "太阳病三日，已发汗，若吐，若下，若温针，仍不解者，此为坏病，桂枝不中与之也。观其脉证，知犯何逆，随证治之。桂枝本为解肌，若其人脉浮紧，发热汗不出者，不可与之也。常须识此，勿令误也。"
  },
  {
    "id": 17,
    "chapter": "辨太阳病脉证并治上",
    "section": "太阳病篇",
    "category": "太阳病",
    "text": "若酒客病，不可与桂枝汤，得之则呕，以酒客不喜甘故也。"
  },
  {
    "id": 18,
    "chapter": "辨太阳病脉证并治上",
    "section": "太阳病篇",
    "category": "太阳病",
    "text": "喘家，作桂枝汤，加厚朴杏子佳。"
  },
  {
    "id": 19,
    "chapter": "辨太阳病脉证并治上",
    "section": "太阳病篇",
    "category": "太阳病",
    "text": "凡服桂枝汤吐者，其后必吐脓血也。"
  },
  {
    "id": 20,
    "chapter": "辨太阳病脉证并治上",
    "section": "太阳病篇",
    "category": "太阳病",
    "text": "太阳病，发汗，遂漏不止，其人恶风，小便难，四肢微急，难以屈伸者，桂枝加附子汤主之。桂枝加附子汤方：桂枝三两去皮，芍药三两，甘草三两炙，生姜三两切，大枣十二枚擘，附子一枚炮去皮破八片。右六味，以水七升，煮取三升，去滓，温服一升。本云：桂枝汤今加附子。将息如前法。"
  },
  {
    "id": 21,
    "chapter": "辨太阳病脉证并治上",
    "section": "太阳病篇",
    "category": "太阳病",
    "text": "太阳病，下之后，脉促胸满者，桂枝去芍药汤主之。桂枝去芍药汤方：桂枝三两去皮，甘草二两炙，生姜三两切，大枣十二枚擘。右四味，以水七升，煮取三升，去滓，温服一升。本云：桂枝汤今去芍药。将息如前法。"
  },
  {
    "id": 22,
    "chapter": "辨太阳病脉证并治上",
    "section": "太阳病篇",
    "category": "太阳病",
    "text": "若微寒者，桂枝去芍药加附子汤主之。桂枝去芍药加附子汤方：桂枝三两去皮，甘草二两炙，生姜三两切，大枣十二枚擘，附子一枚炮去皮破八片。右五味，以水七升，煮取三升，去滓，温服一升。本云：桂枝汤今去芍药加附子。"
  },
  {
    "id": 23,
    "chapter": "辨太阳病脉证并治上",
    "section": "太阳病篇",
    "category": "太阳病",
    "text": "太阳病，得之八九日，如疟状，发热恶寒，热多寒少，其人不呕，圊便欲自可，一日二三度发。脉微缓者，为欲愈也；脉微而恶寒者，此阴阳俱虚，不可更发汗、更下、更吐也；面色反有热色者，未欲解也，以其不能得小汗出，身必痒，宜桂枝麻黄各半汤。桂枝麻黄各半汤方：桂枝一两十六铢去皮，芍药、生姜切、甘草炙、麻黄去节各一两，大枣四枚擘，杏仁二十四枚去皮尖。右七味，以水五升，先煮麻黄一二沸，去上沫，内诸药，煮取一升八合，去滓，温服六合。本云：桂枝汤三合，麻黄汤三合，并为六合。"
  },
  {
    "id": 24,
    "chapter": "辨太阳病脉证并治上",
    "section": "太阳病篇",
    "category": "太阳病",
    "text": "太阳病，初服桂枝汤，反烦不解者，先刺风池、风府，却与桂枝汤则愈。"
  },
  {
    "id": 25,
    "chapter": "辨太阳病脉证并治上",
    "section": "太阳病篇",
    "category": "太阳病",
    "text": "服桂枝汤，大汗出，脉洪大者，与桂枝汤，如前法。若形似疟，一日再发者，汗出必解，宜桂枝二麻黄一汤。桂枝二麻黄一汤方：桂枝一两十七铢去皮，芍药一两六铢，麻黄十六铢去节，生姜一两六铢切，杏仁二十六个去皮尖，甘草一两一铢炙，大枣五枚擘。右七味，以水五升，先煮麻黄一二沸，去上沫，内诸药，煮取二升，去滓，温服一升，日再服。本云：桂枝汤二分，麻黄汤一分，合为二升，分再服。"
  },
  {
    "id": 26,
    "chapter": "辨太阳病脉证并治上",
    "section": "太阳病篇",
    "category": "太阳病",
    "text": "服桂枝汤，大汗出后，大烦渴不解，脉洪大者，白虎加人参汤主之。白虎加人参汤方：知母六两，石膏一斤碎绵裹，甘草二两炙，粳米六合，人参三两。右五味，以水一斗，煮米熟汤成，去滓，温服一升，日三服。"
  },
  {
    "id": 27,
    "chapter": "辨太阳病脉证并治上",
    "section": "太阳病篇",
    "category": "太阳病",
    "text": "太阳病，发热恶寒，热多寒少，脉微弱者，此无阳也，不可发汗。宜桂枝二越婢一汤。桂枝二越婢一汤方：桂枝去皮、芍药、麻黄、甘草炙各十八铢，大枣四枚擘，生姜一两二铢切，石膏二十四铢碎绵裹。右七味，以水五升，先煮麻黄一二沸，去上沫，内诸药，煮取二升，去滓，温服一升。本云：当裁为越婢汤、桂枝汤合之，饮一升。本汤合方，治小儿发热恐微者。"
  },
  {
    "id": 28,
    "chapter": "辨太阳病脉证并治上",
    "section": "太阳病篇",
    "category": "太阳病",
    "text": "太阳病，服桂枝汤，或下之，仍头项强痛，翕翕发热，无汗，心下满，微痛，小便不利者，桂枝去桂加茯苓白术汤主之。桂枝去桂加茯苓白术汤方：芍药三两，甘草二两炙，生姜切、白术、茯苓各三两，大枣十二枚擘。右六味，以水八升，煮取三升，去滓，温服一升。小便利则愈。"
  },
  {
    "id": 29,
    "chapter": "辨太阳病脉证并治上",
    "section": "太阳病篇",
    "category": "太阳病",
    "text": "伤寒脉浮，自汗出，小便数，心烦，微恶寒，脚挛急，反与桂枝汤，欲攻其表，此误也。得之便厥，咽中干，烦躁吐逆者，作甘草干姜汤与之，以复其阳；若厥愈足温者，更作芍药甘草汤与之，其脚即伸；若胃气不和，谵语者，少与调胃承气汤；若重发汗，复加烧针者，四逆汤主之。甘草干姜汤方：甘草四两炙，干姜二两。右二味，以水三升，煮取一升五合，去滓，分温再服。芍药甘草汤方：白芍药、甘草炙各四两。右二味，以水三升，煮取一升五合，去滓，分温再服。调胃承气汤方：大黄四两去皮，清酒洗，甘草二两炙，芒消半升。右三味，以水三升，煮取一升，去滓，内芒消，更上火令烊尽，分温再服。四逆汤方：甘草二两炙，干姜一两半，附子一枚生用去皮破八片。右三味，以水三升，煮取一升二合，去滓，分温再服。强人可大附子一枚，干姜三两。"
  },
  {
    "id": 30,
    "chapter": "辨太阳病脉证并治上",
    "section": "太阳病篇",
    "category": "太阳病",
    "text": "问曰：证象阳旦，按法治之而增剧，厥逆，咽中干，两胫拘急而谵语。师曰：言夜半手足当温，两脚当伸。后如师言，何以知此？答曰：寸口脉浮而大，浮为风，大为虚，风则生微热，虚则两胫挛，病形像桂枝，因加附子参其间，增桂令汗出。附子温经，亡阳故也。厥逆，咽中干，烦躁，阳明内结，谵语烦乱，更饮甘草干姜汤，夜半阳气还，两足当温，胫尚微拘急，重与芍药甘草汤，尔乃胫伸。以承气汤微溏，则止其谵语，故知病可愈。"
  },
  {
    "id": 31,
    "chapter": "辨太阳病脉证并治中",
    "section": "太阳病篇",
    "category": "太阳病",
    "text": "太阳病，项背强几几，无汗恶风，葛根汤主之。葛根汤方：葛根四两，麻黄三两去节，桂枝二两去皮，芍药二两，甘草二两炙，生姜三两切，大枣十二枚擘。右七味，以水一斗，先煮麻黄、葛根，减二升，去上沫，内诸药，煮取三升，去滓，温服一升。覆取微似汗，余如桂枝汤法将息及禁忌。"
  },
  {
    "id": 32,
    "chapter": "辨太阳病脉证并治中",
    "section": "太阳病篇",
    "category": "太阳病",
    "text": "太阳与阳明合病，必自下利，葛根汤主之。"
  },
  {
    "id": 33,
    "chapter": "辨太阳病脉证并治中",
    "section": "太阳病篇",
    "category": "太阳病",
    "text": "太阳与阳明合病，不下利，但呕者，葛根加半夏汤主之。葛根加半夏汤方：葛根四两，麻黄三两去节，甘草二两炙，芍药二两，桂枝二两去皮，生姜二两切，半夏半升洗，大枣十二枚擘。右八味，以水一斗，先煮麻黄、葛根，减二升，去上沫，内诸药，煮取三升，去滓，温服一升。覆取微似汗。"
  },
  {
    "id": 34,
    "chapter": "辨太阳病脉证并治中",
    "section": "太阳病篇",
    "category": "太阳病",
    "text": "太阳病，桂枝证，医反下之，利遂不止，脉促者，表未解也，喘而汗出者，葛根黄芩黄连汤主之。葛根黄芩黄连汤方：葛根半斤，甘草二两炙，黄芩三两，黄连三两。右四味，以水八升，先煮葛根，减二升，内诸药，煮取二升，去滓，分温再服。"
  },
  {
    "id": 35,
    "chapter": "辨太阳病脉证并治中",
    "section": "太阳病篇",
    "category": "太阳病",
    "text": "太阳病，头痛发热，身疼腰痛，骨节疼痛，恶风无汗而喘者，麻黄汤主之。麻黄汤方：麻黄三两去节，桂枝二两去皮，甘草一两炙，杏仁七十个去皮尖。右四味，以水九升，先煮麻黄，减二升，去上沫，内诸药，煮取二升半，去滓，温服八合。覆取微似汗，不须啜粥，余如桂枝汤法将息。"
  },
  {
    "id": 36,
    "chapter": "辨太阳病脉证并治中",
    "section": "太阳病篇",
    "category": "太阳病",
    "text": "太阳与阳明合病，喘而胸满者，不可下，宜麻黄汤。"
  },
  {
    "id": 37,
    "chapter": "辨太阳病脉证并治中",
    "section": "太阳病篇",
    "category": "太阳病",
    "text": "太阳病，十日以去，脉浮细而嗜卧者，外已解也。设胸满胁痛者，与小柴胡汤；脉但浮者，与麻黄汤。"
  },
  {
    "id": 38,
    "chapter": "辨太阳病脉证并治中",
    "section": "太阳病篇",
    "category": "太阳病",
    "text": "太阳中风，脉浮紧，发热恶寒，身疼痛，不汗出而烦躁者，大青龙汤主之。若脉微弱，汗出恶风者，不可服之，服之则厥逆，筋惕肉瞤，此为逆也。大青龙汤方：麻黄六两去节，桂枝二两去皮，甘草二两炙，杏仁四十个去皮尖，生姜三两切，大枣十枚擘，石膏如鸡子大碎。右七味，以水九升，先煮麻黄，减二升，去上沫，内诸药，煮取三升，去滓，温服一升。取微似汗，汗出多者，温粉扑之。一服汗者，停后服。汗多亡阳遂虚，恶风烦躁，不得眠也。"
  },
  {
    "id": 39,
    "chapter": "辨太阳病脉证并治中",
    "section": "太阳病篇",
    "category": "太阳病",
    "text": "伤寒脉浮缓，身不疼但重，不时而轻，无少阴证者，大青龙汤发之。"
  },
  {
    "id": 40,
    "chapter": "辨太阳病脉证并治中",
    "section": "太阳病篇",
    "category": "太阳病",
    "text": "伤寒表不解，心下有水气，干呕发热而咳，或渴，或利，或噎，或小便不利，少腹满，或喘者，小青龙汤主之。小青龙汤方：麻黄去节、芍药、细辛、干姜、甘草炙、桂枝去皮各三两，五味子半升，半夏半升洗。右八味，以水一斗，先煮麻黄减二升，去上沫，内诸药，煮取三升，去滓，温服一升。若渴，去半夏，加瓜蒌根三两；若微利，去麻黄，加荛花如一鸡子，熬令赤色；若噎者，去麻黄，加附子一枚炮；若小便不利，少腹满者，去麻黄，加茯苓四两；若喘，去麻黄，加杏仁半升去皮尖。且荛花不治利，麻黄主喘，今此语反之，疑非仲景意。"
  },
  {
    "id": 41,
    "chapter": "辨太阳病脉证并治中",
    "section": "太阳病篇",
    "category": "太阳病",
    "text": "伤寒，心下有水气，咳而微喘，发热不渴。服汤已渴者，此寒去欲解也。小青龙汤主之。"
  },
  {
    "id": 42,
    "chapter": "辨太阳病脉证并治中",
    "section": "太阳病篇",
    "category": "太阳病",
    "text": "太阳病，外证未解，脉浮弱者，当以汗解，宜桂枝汤。"
  },
  {
    "id": 43,
    "chapter": "辨太阳病脉证并治中",
    "section": "太阳病篇",
    "category": "太阳病",
    "text": "太阳病，下之微喘者，表未解故也，桂枝加厚朴杏子汤主之。桂枝加厚朴杏子汤方：桂枝三两去皮，甘草二两炙，生姜三两切，芍药三两，大枣十二枚擘，厚朴二两炙去皮，杏仁五十枚去皮尖。右七味，以水七升，微火煮取三升，去滓，温服一升。覆取微似汗。"
  },
  {
    "id": 44,
    "chapter": "辨太阳病脉证并治中",
    "section": "太阳病篇",
    "category": "太阳病",
    "text": "太阳病，外证未解者，不可下也，下之为逆。欲解外者，宜桂枝汤。"
  },
  {
    "id": 45,
    "chapter": "辨太阳病脉证并治中",
    "section": "太阳病篇",
    "category": "太阳病",
    "text": "太阳病，先发汗不解，而复下之，脉浮者不愈。浮为在外，而反下之，故令不愈。今脉浮，故在外，当须解外则愈，宜桂枝汤。"
  },
  {
    "id": 46,
    "chapter": "辨太阳病脉证并治中",
    "section": "太阳病篇",
    "category": "太阳病",
    "text": "太阳病，脉浮紧，无汗发热，身疼痛，八九日不解，表证仍在，此当发其汗。服药已微除，其人发烦目瞑，剧者必衄，衄乃解。所以然者，阳气重故也。麻黄汤主之。"
  },
  {
    "id": 47,
    "chapter": "辨太阳病脉证并治中",
    "section": "太阳病篇",
    "category": "太阳病",
    "text": "太阳病，脉浮紧，发热身无汗，自衄者愈。"
  },
  {
    "id": 48,
    "chapter": "辨太阳病脉证并治中",
    "section": "太阳病篇",
    "category": "太阳病",
    "text": "二阳并病，太阳初得病时，发其汗，汗先出不彻，因转属阳明，续自微汗出，不恶寒。若太阳病证不罢者，不可下，下之为逆，如此可小发汗。设面色缘缘正赤者，阳气怫郁在表，当解之熏之。若发汗不彻，不足言，阳气怫郁不得越，当汗不汗，其人躁烦，不知痛处，乍在腹中，乍在四肢，按之不可得，其人短气但坐，以汗出不彻故也，更发汗则愈。何以知汗出不彻？以脉涩故知之。"
  },
  {
    "id": 49,
    "chapter": "辨太阳病脉证并治中",
    "section": "太阳病篇",
    "category": "太阳病",
    "text": "脉浮数者，法当汗出而愈。若下之，身重心悸者，不可发汗，当自汗出乃解。所以然者，尺中脉微，此里虚，须表里实，津液自和，便自汗出愈。"
  },
  {